{
    "version": "2.1",
    "created_at": 1709251200,
    "last_updated": 1709337600,
    "files": {
        "docs/api.md": {
            "hash": "e3b0c44298fc1c149afbf4c8996fb92427ae41e4649b934ca495991b7852b855",
            "last_checked_ts": 1709251200,
            "token_count": 1420,
            "anchors": [
                "Authentication",
                "Authentication > Rate Limiting"
            ],
            "dependencies": [
                "docs/auth.md",
                "crates/cue_core/src/auth.rs"
            ]
        },
        "docs/setup.md": {
            "hash": "a1b2c3d4e5f6789012345678901234567890123456789012345678901234567890",
            "last_checked_ts": 1709251300,
            "token_count": 850,
            "anchors": [
                "Quick Start",
                "Installation"
            ],
            "dependencies": []
        }
    }
}